{
  "schema_version": "scientific-framework/ir/v1",
  "artifact_status": "draft",
  "project": {
    "id": "synthetic-001",
    "title": "合成课堂判断研究",
    "title_status": "provided",
    "working_title": "合成课堂判断研究",
    "source": [
      {
        "source_id": "s-e3ace49e535b6509",
        "format": "txt",
        "file_alias": "proposal.txt",
        "sha256": "e3ace49e535b6509b748acaa1aaefca0f4eb5c3df6c857e60e29157c720a1dc6"
      }
    ],
    "diagram_purpose": "overall_research_approach"
  },
  "nodes": [
    {
      "id": "q",
      "label": "不同资料来源如何支持对课堂判断过程的解释",
      "short_label": "不同资料来源如何支持对课堂判断过程的解释",
      "type": "scientific_question",
      "level": 0,
      "group": "scientific_question",
      "source_text": [
        "不同资料来源如何支持对课堂判断过程的解释"
      ],
      "source_location": [
        {
          "source_id": "s-e3ace49e535b6509",
          "segment_id": "p1",
          "line_start": 1,
          "line_end": 1
        }
      ],
      "confidence": 0.98,
      "needs_review": false,
      "statement_status": "planned",
      "extraction_status": "explicit",
      "core": true
    },
    {
      "id": "c1",
      "label": "还原学生在不同学习条件下形成课堂判断的连续过程并识别关键证据转换环节",
      "short_label": "还原学生在不同学习条件下形成课堂判断的连续过程并识别关键证据转换环节",
      "type": "research_content",
      "level": 1,
      "group": "research_content",
      "source_text": [
        "还原学生在不同学习条件下形成课堂判断的连续过程并识别关键证据转换环节"
      ],
      "source_location": [
        {
          "source_id": "s-e3ace49e535b6509",
          "segment_id": "p2",
          "line_start": 2,
          "line_end": 2
        }
      ],
      "confidence": 0.98,
      "needs_review": false,
      "statement_status": "planned",
      "extraction_status": "explicit",
      "core": true
    },
    {
      "id": "c2",
      "label": "形成条件与比较边界（条件A < 条件B & 情境差异）",
      "short_label": "形成条件与比较边界（条件A < 条件B & 情境差异）",
      "type": "research_content",
      "level": 1,
      "group": "research_content",
      "source_text": [
        "形成条件与比较边界（条件A < 条件B & 情境差异）"
      ],
      "source_location": [
        {
          "source_id": "s-e3ace49e535b6509",
          "segment_id": "p3",
          "line_start": 3,
          "line_end": 3
        }
      ],
      "confidence": 0.98,
      "needs_review": false,
      "statement_status": "planned",
      "extraction_status": "explicit",
      "core": true
    },
    {
      "id": "c3",
      "label": "过程资料的归纳方式",
      "short_label": "过程资料的归纳方式",
      "type": "research_content",
      "level": 1,
      "group": "research_content",
      "source_text": [
        "过程资料的归纳方式"
      ],
      "source_location": [
        {
          "source_id": "s-e3ace49e535b6509",
          "segment_id": "p4",
          "line_start": 4,
          "line_end": 4
        }
      ],
      "confidence": 0.98,
      "needs_review": false,
      "statement_status": "planned",
      "extraction_status": "explicit",
      "core": true
    },
    {
      "id": "c4",
      "label": "评价规则的试行条件",
      "short_label": "评价规则的试行条件",
      "type": "research_content",
      "level": 1,
      "group": "research_content",
      "source_text": [
        "评价规则的试行条件"
      ],
      "source_location": [
        {
          "source_id": "s-e3ace49e535b6509",
          "segment_id": "p5",
          "line_start": 5,
          "line_end": 5
        }
      ],
      "confidence": 0.98,
      "needs_review": false,
      "statement_status": "planned",
      "extraction_status": "explicit",
      "core": true
    },
    {
      "id": "m1",
      "label": "过程追踪法",
      "short_label": "过程追踪法",
      "type": "method",
      "level": 2,
      "group": "method",
      "source_text": [
        "过程追踪法"
      ],
      "source_location": [
        {
          "source_id": "s-e3ace49e535b6509",
          "segment_id": "p6",
          "line_start": 6,
          "line_end": 6
        }
      ],
      "confidence": 0.98,
      "needs_review": false,
      "statement_status": "planned",
      "extraction_status": "explicit",
      "core": true
    },
    {
      "id": "m2",
      "label": "访谈法",
      "short_label": "访谈法",
      "type": "method",
      "level": 2,
      "group": "method",
      "source_text": [
        "访谈法"
      ],
      "source_location": [
        {
          "source_id": "s-e3ace49e535b6509",
          "segment_id": "p6",
          "line_start": 6,
          "line_end": 6
        }
      ],
      "confidence": 0.98,
      "needs_review": false,
      "statement_status": "planned",
      "extraction_status": "explicit",
      "core": true
    },
    {
      "id": "m3",
      "label": "主题分析法",
      "short_label": "主题分析法",
      "type": "method",
      "level": 2,
      "group": "method",
      "source_text": [
        "主题分析法"
      ],
      "source_location": [
        {
          "source_id": "s-e3ace49e535b6509",
          "segment_id": "p6",
          "line_start": 6,
          "line_end": 6
        }
      ],
      "confidence": 0.98,
      "needs_review": false,
      "statement_status": "planned",
      "extraction_status": "explicit",
      "core": true
    },
    {
      "id": "m4",
      "label": "案例比较法",
      "short_label": "案例比较法",
      "type": "method",
      "level": 2,
      "group": "method",
      "source_text": [
        "案例比较法"
      ],
      "source_location": [
        {
          "source_id": "s-e3ace49e535b6509",
          "segment_id": "p6",
          "line_start": 6,
          "line_end": 6
        }
      ],
      "confidence": 0.98,
      "needs_review": false,
      "statement_status": "planned",
      "extraction_status": "explicit",
      "core": true
    },
    {
      "id": "m5",
      "label": "描述统计法",
      "short_label": "描述统计法",
      "type": "method",
      "level": 2,
      "group": "method",
      "source_text": [
        "描述统计法"
      ],
      "source_location": [
        {
          "source_id": "s-e3ace49e535b6509",
          "segment_id": "p6",
          "line_start": 6,
          "line_end": 6
        }
      ],
      "confidence": 0.98,
      "needs_review": false,
      "statement_status": "planned",
      "extraction_status": "explicit",
      "core": true
    },
    {
      "id": "t1",
      "label": "课堂活动一记录",
      "short_label": "课堂活动一记录",
      "type": "research_task",
      "level": 2,
      "group": "research_task",
      "source_text": [
        "课堂活动一记录"
      ],
      "source_location": [
        {
          "source_id": "s-e3ace49e535b6509",
          "segment_id": "p7",
          "line_start": 7,
          "line_end": 7
        }
      ],
      "confidence": 0.98,
      "needs_review": false,
      "statement_status": "planned",
      "extraction_status": "explicit",
      "core": true
    },
    {
      "id": "t2",
      "label": "课堂活动二记录",
      "short_label": "课堂活动二记录",
      "type": "research_task",
      "level": 2,
      "group": "research_task",
      "source_text": [
        "课堂活动二记录"
      ],
      "source_location": [
        {
          "source_id": "s-e3ace49e535b6509",
          "segment_id": "p7",
          "line_start": 7,
          "line_end": 7
        }
      ],
      "confidence": 0.98,
      "needs_review": false,
      "statement_status": "planned",
      "extraction_status": "explicit",
      "core": true
    },
    {
      "id": "t3",
      "label": "课堂活动三记录",
      "short_label": "课堂活动三记录",
      "type": "research_task",
      "level": 2,
      "group": "research_task",
      "source_text": [
        "课堂活动三记录"
      ],
      "source_location": [
        {
          "source_id": "s-e3ace49e535b6509",
          "segment_id": "p7",
          "line_start": 7,
          "line_end": 7
        }
      ],
      "confidence": 0.98,
      "needs_review": false,
      "statement_status": "planned",
      "extraction_status": "explicit",
      "core": true
    },
    {
      "id": "t4",
      "label": "课堂活动四记录",
      "short_label": "课堂活动四记录",
      "type": "research_task",
      "level": 2,
      "group": "research_task",
      "source_text": [
        "课堂活动四记录"
      ],
      "source_location": [
        {
          "source_id": "s-e3ace49e535b6509",
          "segment_id": "p7",
          "line_start": 7,
          "line_end": 7
        }
      ],
      "confidence": 0.98,
      "needs_review": false,
      "statement_status": "planned",
      "extraction_status": "explicit",
      "core": true
    },
    {
      "id": "data",
      "label": "连续过程资料",
      "short_label": "连续过程资料",
      "type": "data",
      "level": 2,
      "group": "data",
      "source_text": [
        "连续过程资料"
      ],
      "source_location": [
        {
          "source_id": "s-e3ace49e535b6509",
          "segment_id": "p7",
          "line_start": 7,
          "line_end": 7
        }
      ],
      "confidence": 0.98,
      "needs_review": false,
      "statement_status": "planned",
      "extraction_status": "explicit",
      "core": true
    },
    {
      "id": "compare",
      "label": "探索性观察，不作严格因果推断",
      "short_label": "探索性观察，不作严格因果推断",
      "type": "comparison",
      "level": 2,
      "group": "comparison",
      "source_text": [
        "探索性观察，不作严格因果推断"
      ],
      "source_location": [
        {
          "source_id": "s-e3ace49e535b6509",
          "segment_id": "p8",
          "line_start": 8,
          "line_end": 8
        }
      ],
      "confidence": 0.98,
      "needs_review": false,
      "statement_status": "planned",
      "extraction_status": "explicit",
      "core": true
    },
    {
      "id": "analysis",
      "label": "综合分析阶段",
      "short_label": "综合分析阶段",
      "type": "process",
      "level": 3,
      "group": "process",
      "source_text": [
        "综合分析阶段"
      ],
      "source_location": [
        {
          "source_id": "s-e3ace49e535b6509",
          "segment_id": "p9",
          "line_start": 9,
          "line_end": 9
        }
      ],
      "confidence": 0.98,
      "needs_review": false,
      "statement_status": "planned",
      "extraction_status": "explicit",